title,description,url,publishedAt
WhatsApp Business could charge users for linking more than four devices - XDA Developers,WhatsApp Business could potentially start charging users who want to link more than four devices to the same account in a future update.,https://www.xda-developers.com/whatsapp-business-could-charge-users/,2022-04-21T12:10:00Z
Google Messages causing severe battery drain and overheating? Here’s a temporary fix - XDA Developers,A bug in Google Messages is causing severe battery drain and overheating on some devices. Here's a temporary fix while you wait for Google to push an update.,https://www.xda-developers.com/google-messages-bug-battery-drain-overheating-fix/,2022-04-21T11:35:00Z
"Redmi 10 Power with 6,000mAh Battery Launched in India: Check Price and Specs - The Quint","Redmi 10 Power Price in India: Redmi has launched its new smartphone Redmi 10 Power in India. The smartphone was launched along with Redmi 10A, on Wednesday, 20 April in India",https://www.thequint.com/tech-and-auto/gadgets/redmi-10-power-launch-date-price-in-india-specs-specifications,2022-04-21T11:23:09Z
"Alienware Doubles Down on AMD, Launches New Ryzen Laptops and Desktop - Gizmodo",The premium Alienware m15 R7 and m17 R5 highlight four new Ryzen-powered systems.,https://gizmodo.com/alienware-m15-r7-m17-r5-dell-g15-aurora-ryzen-editio-1848819822,2022-04-21T11:00:00Z
Apple MagSafe Battery Pack Will Now Charge Your iPhone Faster: Here’s How - News18,Apple is offering its new firmware update for the MagSafe accessory that promises to give you faster charging for the compatible iPhone models.,https://www.news18.com/news/tech/apple-magsafe-battery-pack-will-now-charge-your-iphone-faster-heres-how-5026621.html,2022-04-21T10:41:56Z
Google to kill call-recording apps on Play Store on May 11 - GSMArena.com news - GSMArena.com,System apps with native call-recording functionality remain unaffected.,https://www.gsmarena.com/google_to_kill_callrecording_apps_on_play_store_on_may_11-news-54039.php,2022-04-21T09:53:02Z
"OnePlus Nord 2T moniker confirmed, camera details leaked ahead of India launch - 91mobiles",The OnePlus Nord 2T India launch may take place soon as the moniker has been spotted on the TDRA certification. The OnePlus Nord 2T's camera details have also been leaked. Here are the expected specifications of the device.,https://www.91mobiles.com/hub/oneplus-nord-2t-moniker-confirmed-camera-details-leaked-ahead-of-india-launch/,2022-04-21T09:45:22Z
iPhones with full-screen display? Apple may introduce under-display camera and Face ID in 2024 - Economic Times,The iPhone 16 is likely to be the first Apple device to skip the camera notch.,https://economictimes.indiatimes.com/magazines/panache/iphones-with-full-screen-display-apple-may-introduce-under-display-camera-and-face-id-in-2024/articleshow/90978007.cms,2022-04-21T09:35:00Z
Garena Free Fire Max Codes For April 21: Here's How To Redeem Them For Free Rewards - ABP Live,Garena Free Fire Max redeem codes are 12-digit codes that are region-specific and can be used by players to gain an edge over rivals in every round of the battle royale game.,https://news.abplive.com/technology/garena-free-fire-max-redeem-codes-date-heres-how-to-get-redeem-free-rewards-codes-1527539,2022-04-21T09:30:28Z
"Realme Announces Narzo 50a Prime For Next Week, To Come Without Charger | Mint - Mint","We are still not sure that no-charger policy will be limited to Narzo 50A Prime or it will be extended to other Realme budget, mid-segment and premium phones",https://www.livemint.com/technology/realme-announces-narzo-50a-prime-for-next-week-to-come-without-charger-11650532243547.html,2022-04-21T09:14:26Z
This MacOS inspired new Windows 11 feature will let you view files without opening them - HT Tech,A new Windows 11 feature will finally let you preview files and quickly view the content before you open them. This feature was already available for MacOS users but finally it is coming to Windows 11 as well,https://tech.hindustantimes.com/tech/news/this-macos-inspired-new-windows-11-feature-will-let-you-view-files-without-opening-them-71650531863260.html,2022-04-21T09:10:28Z
10 best Minecraft Java Edition seeds for speedrunning in 2022 - Sportskeeda,A speedrun in Minecraft is a playthrough of the game to complete tasks as fast as possible.,https://www.sportskeeda.com/minecraft/10-best-minecraft-java-edition-seeds-speedrunning-2022,2022-04-21T08:57:50Z
NVIDIA AD102 GPU Flagships To Consume Insane Amounts of Power: Gaming GeForce RTX 4090 at 600W TBP & Workstation RTX L6000 at 375W TBP - Wccftech,NVIDIA's GeForce RTX 4090 Gaming & RTX L6000 Workstation graphics cards are rumored to feature TBPs of over 600W in reference flavors.,https://wccftech.com/nvidia-ad102-gpu-geforce-rtx-4090-600w-tbp-rtx-l6000-375w-tbp-graphics-card-rumor/,2022-04-21T08:31:35Z
"Best Laptop deals under 40000: From HP Chromebook to Samsung Galaxy Book Go, check options - HT Tech","Looking for the best Laptop deals under 40000? We have a few options for you from Samsung, HP, Asus, and Lenovo. Check here.",https://tech.hindustantimes.com/laptops-pc/news/best-laptop-deals-under-40000-from-hp-chromebook-to-samsung-galaxy-book-go-check-options-71650528627983.html,2022-04-21T08:18:37Z
Xiaomi Civi 1S arrives with a Snapdragon 778G+ chipset - GSMArena.com news - GSMArena.com,The rest of the specs remain exactly the same.,https://www.gsmarena.com/xiaomi_civi_1s_comes_with_a_snapdragon_778g-news-54038.php,2022-04-21T07:52:01Z
"Realme Pad Mini, Buds Q2s and smart TVs to launch in India on April 29 - Times of India",Realme is all set to launch a slew of products in India next week. The Chinese smartphone maker has already confirmed that it will launch Realme GT 2,https://timesofindia.indiatimes.com/gadgets-news/realme-pad-mini-buds-q2s-and-smart-tvs-to-launch-in-india-on-april-29/articleshow/90975490.cms,2022-04-21T07:33:00Z
"iPhone 14 Pro And iPhone 14 Pro Max May Get Faster Data Transfer Speed, But No USB-C Port - Watch - India.com",Apple may equip the iPhone 14 pro models with faster USB 3.0 speed. Watch video for more details.,https://www.india.com/video-gallery/iphone-14-pro-and-iphone-14-pro-max-may-get-faster-data-transfer-speed-but-no-usb-c-port-watch-5348925/,2022-04-21T05:41:00Z
"Massive iPhone 12, iPhone 12 mini price drop coming! Reason? iPhone 14 launch - HT Tech",Apple will reportedly roll out iPhone 12 and iPhone 12 mini price drop after iPhone 14 launch.,https://tech.hindustantimes.com/mobile/news/massive-iphone-12-iphone-12-mini-price-drop-coming-reason-iphone-14-launch-71650517244784.html,2022-04-21T05:05:15Z
Google's iPhone app for wirelessly switching to Android will be ready for Pixel owners in a few weeks - The Verge,"Google’s Switch to Android iOS app is starting to roll out, but it won’t be fully available in the App Store until Pixel devices have been updated with support for the feature. They’re the first Android phones to support it.",https://www.theverge.com/2022/4/20/23034459/switch-to-android-google-iphone-app,2022-04-21T03:59:39Z
Research shows how some apps keep tracking users despite new iOS privacy features - 9to5Mac,Some developers have figured out new ways to keep tracking iOS users even when they opt out of being tracked by third-party apps.,https://9to5mac.com/2022/04/20/research-shows-how-some-apps-keep-tracking-users-despite-new-ios-privacy-features/,2022-04-21T03:47:00Z
I tried Samsung’s Galaxy Book 2 Pro 360 for a week and here’s why it’s perfect for me - The Indian Express,"The responsive screen, S Pen compatibility, terrific keyboard and long battery life all make the Galaxy Book 2 Pro 360 closer to a perfect notebook, but my reason for getting excited about this device is its ultra-portability.",https://indianexpress.com/article/technology/tech-reviews/samsungs-galaxy-book-2-pro-360-review-7877552/,2022-04-21T03:45:22Z
Android users may soon get this new WhatsApp shortcut - Times of India,WhatsApp is also reportedly working on a new feature that will make it easier for you to message unsaved contacts. Currently when you tap on a phone n,https://timesofindia.indiatimes.com/gadgets-news/android-users-may-soon-get-this-new-whatsapp-shortcut/articleshow/90970477.cms,2022-04-21T03:23:00Z
Judge fines Apple for not including power brick in iPhone box - PhoneArena,"Apple was fined the equivalent of $1,081 in Brazil for selling a consumer an iPhone without including the power adapter in the box.",https://www.phonearena.com/news/brazilian-judge-says-apple-must-pay-for-not-including-charger-in-iphone-box_id139761,2022-04-20T23:53:13Z
HP Pavilion laptops powered by Intel Core processors launched - InfotechLead.com,"HP has launched its Pavilion laptops powered by 12th Gen Intel Core processors for a starting price of Rs 55,999.",https://infotechlead.com/devices/hp-pavilion-laptops-powered-by-intel-core-processors-launched-72189,2022-04-20T21:50:36Z
New Chrome Web Store badges will help you find the best browser extensions - Android Central,Only the highest-quality Chrome extensions for you.,https://www.androidcentral.com/apps-software/chrome-web-store-featured-established-publisher-badges,2022-04-20T21:29:36Z
Android 13 will bring a new gesture for enabling multi-window on apps - Gizchina.com,Google is working on a new gesture shortcut for Android 13 that will push apps' notifications into the multi-window mode.,https://www.gizchina.com/2022/04/20/android-13-will-bring-a-new-gesture-for-enabling-multi-window-on-apps/,2022-04-20T20:59:37Z
How to create a battery report on Windows 11 to learn more about it - XDA Developers,Creating a battery report in Windows 11 is a great way to learn how well your laptop's battery is doing. Here's how to do it.,https://www.xda-developers.com/how-to-create-battery-report-windows-11/,2022-04-20T19:00:00Z
Instagram to rank based on originality & improve product and people tagging - iMore,Instagram has announced changes to the way it ranks content as well as improvements to product and people tags that will open them up to more people than ever before.,https://www.imore.com/instagram-will-now-rank-based-originality-improve-product-and-people-tagging,2022-04-20T18:35:20Z
Samsung is launching a Pokémon themed Galaxy Z Flip 3 in South Korea - XDA Developers,"Samsung is launching a special Pokemon edition of the Galaxy Z Flip 3 in South Korea, and it looks like an interesting set for collectors.",https://www.xda-developers.com/samsung-is-launching-a-pokemon-themed-galaxy-z-flip-3-in-south-korea/,2022-04-20T18:15:00Z
Google Search now shows detailed air quality information in three countries [U] - 9to5Google,"Last year, Google started showing air quality (AQI) data to Nest Hub and other Smart Display users. Google Search air quality is now...",https://9to5google.com/2022/04/20/google-search-air-quality/,2022-04-20T17:33:00Z
"‘Among Us VR’ Gets First Gameplay Trailer, Coming to Quest & PC VR This Holiday, PSVR 2 Eventually - Road to VR",Party game sensation Among Us has been known to be getting a full-blown VR version since late last year but now we’re getting our first good look at some gameplay. Developer Schell Games has also floated a ‘holiday 2022’ release date for the game on Quest and…,https://www.roadtovr.com/among-us-vr-gameplay-trailer-quest-2-pc-vr-psvr-2-release-date/,2022-04-20T17:07:46Z
European politicians on the cusp of requiring USB-C in all smartphones - AppleInsider,"European Union officials have voted to support a long-planned proposal to require Apple, and all technology firms, to adopt USB-C as a common charger, and add a new requirement for a standard for wireless charging.",https://appleinsider.com/articles/22/04/20/european-politicians-on-the-cusp-of-requiring-usb-c-in-all-smartphones,2022-04-20T16:48:30Z
Galaxy A73 5G review: The 10-point review of Samsung’s most affordable 108MP camera smartphone - Gadgets Now,"Samsung Galaxy A73 5G is the company’s latest affordable flagship smartphone. It offers impressive features like a 120Hz super AMOLED display, 108MP primary sensor and a capable Snapdragon chipset. Samsung has launched the smartphone at a starting price of Rs…",https://www.gadgetsnow.com/slideshows/galaxy-a73-5g-review-the-10-point-review-of-samsungs-most-affordable-108mp-camera-smartphone/photolist/90964213.cms,2022-04-20T16:02:00Z
Galaxy S22 Ultra review two months later: Is the Galaxy Note still alive? - SamMobile,It's been a couple of months since the Galaxy S22 Ultra became the daily driver for a few members of ...,https://www.sammobile.com/news/galaxy-s22-ultra-review-two-months-later-is-the-note-still-alive/,2022-04-20T15:26:00Z
Motorola Edge (2021) and Motorola Edge Plus start receiving the stable Android 12 update - XDA Developers,Motorola has started rolling out Android 12 to the Motorola Edge (2021) and Motorola Edge Plus. Read on to know more.,https://www.xda-developers.com/motorola-edge-2021-motorola-edge-plus-android-12-update/,2022-04-20T15:21:00Z
"Google Pixel 6a specs: Tensor chip, 6GB RAM, 12MP camera, and everything else we know so far - 9to5Google","Google's Pixel 6a is coming and with it, one of the strongest set of specs we've seen for the mid-range lineup. Here's what we know.",https://9to5google.com/2022/04/20/google-pixell-6a-specs/,2022-04-20T14:23:00Z
Apple's most exciting MacBook yet could arrive at WWDC - Creative Bloq,June is already looking good.,https://www.creativebloq.com/news/wwdc-macbook-2022,2022-04-20T14:14:21Z
How to update a PlayStation DualSense wireless controller using a Windows PC - XDA Developers,Here's how you can update your PlayStation DualSense wireless controller using just a Windows 10 or Windows 11 PC. No PlayStation 5 required.,https://www.xda-developers.com/update-dualsense-wireless-controller-using-windows-pc/,2022-04-20T13:50:00Z
Brave adds Discussions to enrich its search results - BleepingComputer,"Brave, the maker of the homonymous web browser, has announced a new feature called Discussions that adds conversations from online forums to its privacy-focused search engine.",https://www.bleepingcomputer.com/news/software/brave-adds-discussions-to-enrich-its-search-results/,2022-04-20T13:00:00Z
Apple’s new iPhone 14 Pro design is jaw-dropping in this video - BGR,Apple's iPhone 14 Pro design will reportedly eliminate the notch and replace it with a pill-shaped cutout and a hole-punch selfie camera.,http://bgr.com/tech/apples-new-iphone-14-pro-design-is-jaw-dropping-in-this-video/,2022-04-20T12:41:00Z
Apple touts its environmental credentials - ABC News,The company says nearly 20% of all materials used in its products last year were recycled.,https://www.youtube.com/watch?v=W9oBG2qwxR4,2022-04-20T11:57:49Z
Report: Carrier sales of Pixel 6 series falter despite high salesperson incentives - 9to5Google,A report by industry analytics firm Wave7 claims that carrier sales of the Pixel 6 series have been low despite high salesperson kickbacks.,https://9to5google.com/2022/04/20/report-carrier-sales-of-pixel-6-series-falter-despite-high-salesperson-incentives/,2022-04-20T11:00:00Z
"Tiny Tina's Wonderlands: Coiled Captors —Release date, all upcoming new content, and more - Sportskeeda",Tiny Tina's Wonderlands: Coiled Captors is set to become the first DLC of the game to increase the fun factor for players. The game has received significant success from fans and critics alike.,https://www.sportskeeda.com/esports/news-tiny-tina-s-wonderlands-coiled-captors-release-date-upcoming-new-content,2022-04-20T10:46:10Z
Here’s one of the Samsung Galaxy Z Fold 4 batteries - SamMobile,"Whether or not the Galaxy Z Fold 4 will have a built-in S Pen, no one knows for sure at ...",https://www.sammobile.com/news/samsung-galaxy-z-fold-4-battery-photo/,2022-04-20T10:24:00Z
"OnePlus Nord N20 5G with Snapdragon 695, 64MP triple cameras launched: price, specifications - 91mobiles","OnePlus Nord N20 5G has been launched officially. Key specifications include a 64MP primary camera, Android 11 OS and 33W fast charging support. Read on to know the price and sale details of OnePlus Nord N20 5G.",https://www.91mobiles.com/hub/oneplus-nord-n20-5g-with-snapdragon-695-64mp-triple-cameras-launched-price-specifications/,2022-04-20T10:06:55Z
Samsung Galaxy S23 series to arrive with big battery upgrades thanks to EV battery tech adoption - Notebookcheck.net,"New reports indicate that Samsung will equip the Galaxy S23 series with bigger batteries, likely in a bid to finally match Apple's class-leading battery endurance. These upgrades will come thanks to a ""new"" battery technology that promises 10% better energy d…",https://www.notebookcheck.net/Samsung-Galaxy-S23-series-to-arrive-with-big-battery-upgrades-thanks-to-EV-battery-tech-adoption.614500.0.html,2022-04-20T09:58:07Z
"Realme Q5 Pro debuts with 80W charging, vanilla Q5 tags along - GSMArena.com news - GSMArena.com","The phones have familiar bodies, but new internals.",https://www.gsmarena.com/realme_launches_q5_with_60w_fast_charging_q5_pro_brings_80w_rates-news-54020.php,2022-04-20T09:15:01Z
Brave’s new De-AMP feature lets you easily bypass AMP pages - XDA Developers,"Popular Chromium-based browser Brave has introduced a new feature called De-AMP, which lets users easily bypass AMP pages.",https://www.xda-developers.com/brave-de-amp-feature/,2022-04-20T09:15:00Z
Decentralized Twitter alternative Mastodon officially arrives on the Google Play Store - 9to5Google,"The open-source alternative to Twitter, Mastodon, is now officially available to download on Android via the Google Play Store.",https://9to5google.com/2022/04/20/decentralized-twitter-alternative-mastodon-officially-arrives-on-the-google-play-store/,2022-04-20T09:03:00Z
"Samsung Galaxy M53 5G Roundup: Expected Price in India, Launch Event Time, Specifications, Features - MySmartPrice",Samsung is planning to launch the Samsung Galaxy M53 5G in India on April 22nd. Here's everything you need to know!,https://www.mysmartprice.com/gear/samsung-galaxy-m53-roundup/,2022-04-20T07:09:33Z
OPPO F21 Pro review: the glamorous phone - 91mobiles Hindi News,"The OPPO F21 Pro looks great and feels great, but is it a value for money offering? Read on to find out.",https://www.91mobiles.com/hub/oppo-f21-pro-review/,2022-04-20T06:27:54Z
Google’s Nearby Share expected to receive a “Self Share” feature - GSMArena.com news - GSMArena.com,"This would allow you to transfer files between devices on the same account, skipping the confirmation step.",https://www.gsmarena.com/googles_nearby_share_expected_to_receive_a_self_share_feature-news-54013.php,2022-04-20T03:45:01Z
"Google Pixel Watch leaks again, and it looks familiar - XDA Developers","A Pixel Watch render has leaked, showing off its circular display and potentially adding credence to previous leaks. Check it out here.",https://www.xda-developers.com/google-pixel-watch-render-leaks-rohan/,2022-04-20T01:20:00Z
iOS 15.5 beta 2 hints at Apple Pay support for Bancomat and Bancontact networks - 9to5Mac,iOS 15.5 beta 2 code analyzed by 9to5Mac shows that Apple Pay will soon support Bancomat and Bancontact networks.,https://9to5mac.com/2022/04/19/ios-15-5-beta-2-hints-at-apple-pay-support-for-bancomat-and-bancontact-networks/,2022-04-19T23:19:00Z
Google may be reviving ‘Wallet’ branding as home for payment cards and passes on Android [U] - 9to5Google,"Google may be bringing back their classic ""Wallet"" name to be Android's home for contactless payment cards and important passes.",https://9to5google.com/2022/04/19/google-wallet-brand-revival-payment-cards-passes-android/,2022-04-19T18:28:00Z
How to Block Ads on Spotify - Lifehacker,You can get one of Spotify Premium's best features for free.,https://lifehacker.com/how-to-block-ads-on-spotify-1848811961,2022-04-19T18:00:00Z
"iPhone SE 3 sales continue to disappoint, new carrier survey data shows - 9to5Mac","Several analysts have indicated recently that Apple’s new iPhone SE 3 is selling lower than the company had expected. Now, a new report from research firm Wave7 corroborates those analysts, with new data based on surveys from carrier stores across the United …",https://9to5mac.com/2022/04/19/iphone-se-3-sales-disappoint/,2022-04-19T15:46:00Z
AMD Ryzen Pro 6000 series launched: Custom Ryzen 7 6860Z in Lenovo ThinkPad Z13 shown to be 17% faster than Core i7-1260P - Notebookcheck.net,,https://www.notebookcheck.net/AMD-Ryzen-Pro-6000-series-launched-Custom-Ryzen-7-6860Z-in-Lenovo-ThinkPad-Z13-shown-to-be-17-faster-than-Core-i7-1260P.613819.0.html,2022-04-19T15:17:46Z
"Samsung launches Neo QLED premium TV range in India, price starts at Rs 1.49 lakh - Times of India","Samsung has launched its 2022 Neo QLED 8K and Neo QLED TVs in India today. Unveiled at CES 2022, Samsung claims that the new Neo QLED TV range is desi",https://timesofindia.indiatimes.com/gadgets-news/samsung-launches-neo-qled-premium-tv-range-in-india-price-starts-at-rs-1-49-lakh/articleshow/90940278.cms,2022-04-19T14:15:00Z
"WhatsApp's Latest Update Will Let Users Hide Their Last Seen, Status And Profile Picture From Specific Contac - India.com","People can now choose who they want to hide their status, last seen and profile picture from, on WhatsApp. Reportedly, the feature is under development and is tested on Android and iOS beta.",https://www.india.com/video-gallery/whatsapps-latest-update-will-let-users-hide-their-last-seen-from-specific-contacts-checkout-details-5346042/,2022-04-19T12:00:00Z
"Revolutionizing smartphone gaming, the OnePlus 10 Pro is in line with must-have smartphone gaming feature - Times of India",Spotlight News: The smartphone brand is known to combine industry-leading hardware with incredible software since 2013 to deliver the very best user experience to its,https://timesofindia.indiatimes.com/spotlight/revolutionizing-smartphone-gaming-the-oneplus-10-pro-is-in-line-with-must-have-smartphone-gaming-features/articleshow/90935899.cms,2022-04-19T11:46:00Z
